{"schemaVersion":"1","modelVersion":"2.2.0","sim":"team","seed":42,"iterations":500,"horizon":60,"series":{"brittlenessRate":[{"t":0,"p10":0.0,"p50":0.0,"p90":0.0},{"t":1,"p10":0.0,"p50":0.0,"p90":0.0},{"t":2,"p10":0.0,"p50":0.0,"p90":0.0},{"t":3,"p10":0.0,"p50":0.0,"p90":0.0},{"t":4,"p10":0.0,"p50":0.0,"p90":0.0},{"t":5,"p10":0.0,"p50":0.0,"p90":0.0},{"t":6,"p10":0.0,"p50":0.0,"p90":0.0},{"t":7,"p10":0.0,"p50":0.0,"p90":0.0},{"t":8,"p10":0.0,"p50":0.0,"p90":0.0},{"t":9,"p10":0.0,"p50":0.0,"p90":0.0},{"t":10,"p10":0.0,"p50":0.0,"p90":0.0},{"t":11,"p10":0.0,"p50":0.0,"p90":0.0},{"t":12,"p10":0.0,"p50":0.0,"p90":0.0},{"t":13,"p10":0.0,"p50":0.0,"p90":0.0},{"t":14,"p10":0.0,"p50":0.0,"p90":0.0},{"t":15,"p10":0.0,"p50":0.0,"p90":0.0},{"t":16,"p10":0.0,"p50":0.0,"p90":0.0},{"t":17,"p10":0.0,"p50":0.0,"p90":0.0},{"t":18,"p10":0.0,"p50":0.0,"p90":0.0},{"t":19,"p10":0.0,"p50":0.0,"p90":0.0},{"t":20,"p10":0.0,"p50":0.0,"p90":0.0},{"t":21,"p10":0.0,"p50":0.0,"p90":0.0},{"t":22,"p10":0.0,"p50":0.0,"p90":0.0},{"t":23,"p10":0.0,"p50":0.0,"p90":0.0},{"t":24,"p10":0.0,"p50":0.0,"p90":0.0},{"t":25,"p10":0.0,"p50":0.0,"p90":0.0},{"t":26,"p10":0.0,"p50":0.0,"p90":0.0},{"t":27,"p10":0.0,"p50":0.0,"p90":0.0},{"t":28,"p10":0.0,"p50":0.0,"p90":0.0},{"t":29,"p10":0.0,"p50":0.0,"p90":0.0},{"t":30,"p10":0.0,"p50":0.0,"p90":0.0},{"t":31,"p10":0.0,"p50":0.0,"p90":0.0},{"t":32,"p10":0.0,"p50":0.0,"p90":0.0},{"t":33,"p10":0.0,"p50":0.0,"p90":0.0},{"t":34,"p10":0.0,"p50":0.0,"p90":0.0},{"t":35,"p10":0.0,"p50":0.0,"p90":0.0},{"t":36,"p10":0.0,"p50":0.0,"p90":0.0},{"t":37,"p10":0.0,"p50":0.0,"p90":0.0},{"t":38,"p10":0.0,"p50":0.0,"p90":0.0},{"t":39,"p10":0.0,"p50":0.0,"p90":0.0},{"t":40,"p10":0.0,"p50":0.0,"p90":0.0},{"t":41,"p10":0.0,"p50":0.0,"p90":0.0},{"t":42,"p10":0.0,"p50":0.0,"p90":0.0},{"t":43,"p10":0.0,"p50":0.0,"p90":0.0},{"t":44,"p10":0.0,"p50":0.0,"p90":0.0},{"t":45,"p10":0.0,"p50":0.0,"p90":0.0},{"t":46,"p10":0.0,"p50":0.0,"p90":0.0},{"t":47,"p10":0.0,"p50":0.0,"p90":0.0},{"t":48,"p10":0.0,"p50":0.0,"p90":0.0},{"t":49,"p10":0.0,"p50":0.0,"p90":0.0},{"t":50,"p10":0.0,"p50":0.0,"p90":0.0},{"t":51,"p10":0.0,"p50":0.0,"p90":0.0},{"t":52,"p10":0.0,"p50":0.0,"p90":0.0},{"t":53,"p10":0.0,"p50":0.0,"p90":0.0},{"t":54,"p10":0.0,"p50":0.0,"p90":0.0},{"t":55,"p10":0.0,"p50":0.0,"p90":0.0},{"t":56,"p10":0.0,"p50":0.0,"p90":0.0},{"t":57,"p10":0.0,"p50":0.0,"p90":0.0},{"t":58,"p10":0.0,"p50":0.0,"p90":0.0},{"t":59,"p10":0.0,"p50":0.0,"p90":0.0}],"cohesion":[{"t":0,"p10":75.0,"p50":75.0,"p90":75.0},{"t":1,"p10":74.76905098089057,"p50":74.76905098089057,"p90":74.76905098089057},{"t":2,"p10":74.54964941273661,"p50":74.54964941273661,"p90":74.54964941273661},{"t":3,"p10":74.34121792299035,"p50":74.34121792299035,"p90":74.34121792299035},{"t":4,"p10":74.1432080077314,"p50":74.1432080077314,"p90":74.1432080077314},{"t":5,"p10":73.9550985882354,"p50":73.9550985882354,"p90":73.9550985882354},{"t":6,"p10":73.7763946397142,"p50":73.7763946397142,"p90":73.7763946397142},{"t":7,"p10":73.60662588861906,"p50":73.60662588861906,"p90":73.60662588861906},{"t":8,"p10":73.44534557507868,"p50":73.44534557507868,"p90":73.44534557507868},{"t":9,"p10":73.29212927721531,"p50":73.29212927721531,"p90":73.29212927721531},{"t":10,"p10":73.14657379424511,"p50":73.14657379424511,"p90":73.14657379424511},{"t":11,"p10":73.00829608542342,"p50":73.00829608542342,"p90":73.00829608542342},{"t":12,"p10":72.87693226204283,"p50":72.87693226204283,"p90":72.87693226204283},{"t":13,"p10":72.75213662983126,"p50":72.75213662983126,"p90":72.75213662983126},{"t":14,"p10":72.63358077923026,"p50":72.63358077923026,"p90":72.63358077923026},{"t":15,"p10":72.52095272115932,"p50":72.52095272115932,"p90":72.52095272115932},{"t":16,"p10":72.41395606599193,"p50":72.41395606599193,"p90":72.41395606599193},{"t":17,"p10":72.3123092435829,"p50":72.3123092435829,"p90":72.3123092435829},{"t":18,"p10":72.21574476229432,"p50":72.21574476229432,"p90":72.21574476229432},{"t":19,"p10":72.12400850507018,"p50":72.12400850507018,"p90":72.12400850507018},{"t":20,"p10":72.03685906070724,"p50":72.03685906070724,"p90":72.03685906070724},{"t":21,"p10":71.95406708856245,"p50":71.95406708856245,"p90":71.95406708856245},{"t":22,"p10":71.8754147150249,"p50":71.8754147150249,"p90":71.8754147150249},{"t":23,"p10":71.80069496016422,"p50":71.80069496016422,"p90":71.80069496016422},{"t":24,"p10":71.72971119304658,"p50":71.72971119304658,"p90":71.72971119304658},{"t":25,"p10":71.66227661428482,"p50":71.66227661428482,"p90":71.66227661428482},{"t":26,"p10":71.59821376446115,"p50":71.59821376446115,"p90":71.59821376446115},{"t":27,"p10":71.53735405712867,"p50":71.53735405712867,"p90":71.53735405712867},{"t":28,"p10":71.4795373351628,"p50":71.4795373351628,"p90":71.4795373351628},{"t":29,"p10":71.42461144929523,"p50":71.42461144929523,"p90":71.42461144929523},{"t":30,"p10":71.37243185772104,"p50":71.37243185772104,"p90":71.37243185772104},{"t":31,"p10":71.32286124572556,"p50":71.32286124572556,"p90":71.32286124572556},{"t":32,"p10":71.27576916432986,"p50":71.27576916432986,"p90":71.27576916432986},{"t":33,"p10":71.23103168700393,"p50":71.23103168700393,"p90":71.23103168700393},{"t":34,"p10":71.1885310835443,"p50":71.1885310835443,"p90":71.1885310835443},{"t":35,"p10":71.14815551025767,"p50":71.14815551025767,"p90":71.14815551025767},{"t":36,"p10":71.10979871563535,"p50":71.10979871563535,"p90":71.10979871563535},{"t":37,"p10":71.07335976074415,"p50":71.07335976074415,"p90":71.07335976074415},{"t":38,"p10":71.03874275359752,"p50":71.03874275359752,"p90":71.03874275359752},{"t":39,"p10":71.00585659680821,"p50":71.00585659680821,"p90":71.00585659680821},{"t":40,"p10":70.97461474785837,"p50":70.97461474785837,"p90":70.97461474785837},{"t":41,"p10":70.94493499135602,"p50":70.94493499135602,"p90":70.94493499135602},{"t":42,"p10":70.91673922267879,"p50":70.91673922267879,"p90":70.91673922267879},{"t":43,"p10":70.88995324243541,"p50":70.88995324243541,"p90":70.88995324243541},{"t":44,"p10":70.86450656120421,"p50":70.86450656120421,"p90":70.86450656120421},{"t":45,"p10":70.84033221403458,"p50":70.84033221403458,"p90":70.84033221403458},{"t":46,"p10":70.81736658422342,"p50":70.81736658422342,"p90":70.81736658422342},{"t":47,"p10":70.79554923590283,"p50":70.79554923590283,"p90":70.79554923590283},{"t":48,"p10":70.77482275499825,"p50":70.77482275499825,"p90":70.77482275499825},{"t":49,"p10":70.75513259813891,"p50":70.75513259813891,"p90":70.75513259813891},{"t":50,"p10":70.73642694912255,"p50":70.73642694912255,"p90":70.73642694912255},{"t":51,"p10":70.71865658255699,"p50":70.71865658255699,"p90":70.71865658255699},{"t":52,"p10":70.70177473431971,"p50":70.70177473431971,"p90":70.70177473431971},{"t":53,"p10":70.6857369784943,"p50":70.6857369784943,"p90":70.6857369784943},{"t":54,"p10":70.67050111046017,"p50":70.67050111046017,"p90":70.67050111046017},{"t":55,"p10":70.65602703582773,"p50":70.65602703582773,"p90":70.65602703582773},{"t":56,"p10":70.64227666492691,"p50":70.64227666492691,"p90":70.64227666492691},{"t":57,"p10":70.62921381257114,"p50":70.62921381257114,"p90":70.62921381257114},{"t":58,"p10":70.61680410283316,"p50":70.61680410283316,"p90":70.61680410283316},{"t":59,"p10":70.60501487858207,"p50":70.60501487858207,"p90":70.60501487858207}],"coordinationTax":[{"t":0,"p10":0.13399043306253325,"p50":0.13399043306253325,"p90":0.13399043306253325},{"t":1,"p10":0.13399043306253325,"p50":0.13399043306253325,"p90":0.13399043306253325},{"t":2,"p10":0.13399043306253325,"p50":0.13399043306253325,"p90":0.13399043306253325},{"t":3,"p10":0.13399043306253325,"p50":0.13399043306253325,"p90":0.13399043306253325},{"t":4,"p10":0.13399043306253325,"p50":0.13399043306253325,"p90":0.13399043306253325},{"t":5,"p10":0.13399043306253325,"p50":0.13399043306253325,"p90":0.13399043306253325},{"t":6,"p10":0.13399043306253325,"p50":0.13399043306253325,"p90":0.13399043306253325},{"t":7,"p10":0.13399043306253325,"p50":0.13399043306253325,"p90":0.13399043306253325},{"t":8,"p10":0.13399043306253325,"p50":0.13399043306253325,"p90":0.13399043306253325},{"t":9,"p10":0.13399043306253325,"p50":0.13399043306253325,"p90":0.13399043306253325},{"t":10,"p10":0.13399043306253325,"p50":0.13399043306253325,"p90":0.13399043306253325},{"t":11,"p10":0.13399043306253325,"p50":0.13399043306253325,"p90":0.13399043306253325},{"t":12,"p10":0.13399043306253325,"p50":0.13399043306253325,"p90":0.13399043306253325},{"t":13,"p10":0.13399043306253325,"p50":0.13399043306253325,"p90":0.13399043306253325},{"t":14,"p10":0.13399043306253325,"p50":0.13399043306253325,"p90":0.13399043306253325},{"t":15,"p10":0.13399043306253325,"p50":0.13399043306253325,"p90":0.13399043306253325},{"t":16,"p10":0.13399043306253325,"p50":0.13399043306253325,"p90":0.13399043306253325},{"t":17,"p10":0.13399043306253325,"p50":0.13399043306253325,"p90":0.13399043306253325},{"t":18,"p10":0.13399043306253325,"p50":0.13399043306253325,"p90":0.13399043306253325},{"t":19,"p10":0.13399043306253325,"p50":0.13399043306253325,"p90":0.13399043306253325},{"t":20,"p10":0.13399043306253325,"p50":0.13399043306253325,"p90":0.13399043306253325},{"t":21,"p10":0.13399043306253325,"p50":0.13399043306253325,"p90":0.13399043306253325},{"t":22,"p10":0.13399043306253325,"p50":0.13399043306253325,"p90":0.13399043306253325},{"t":23,"p10":0.13399043306253325,"p50":0.13399043306253325,"p90":0.13399043306253325},{"t":24,"p10":0.13399043306253325,"p50":0.13399043306253325,"p90":0.13399043306253325},{"t":25,"p10":0.13399043306253325,"p50":0.13399043306253325,"p90":0.13399043306253325},{"t":26,"p10":0.13399043306253325,"p50":0.13399043306253325,"p90":0.13399043306253325},{"t":27,"p10":0.13399043306253325,"p50":0.13399043306253325,"p90":0.13399043306253325},{"t":28,"p10":0.13399043306253325,"p50":0.13399043306253325,"p90":0.13399043306253325},{"t":29,"p10":0.13399043306253325,"p50":0.13399043306253325,"p90":0.13399043306253325},{"t":30,"p10":0.13399043306253325,"p50":0.13399043306253325,"p90":0.13399043306253325},{"t":31,"p10":0.13399043306253325,"p5